<?xml version="1.0"?>
<!DOCTYPE modulesynopsis SYSTEM "../style/modulesynopsis.dtd">
<?xml-stylesheet type="text/xsl" href="../style/manual.en.xsl"?>
<!-- $LastChangedRevision$ -->

<!--
 Licensed to the Apache Software Foundation (ASF) under one or more
 contributor license agreements.  See the NOTICE file distributed with
 this work for additional information regarding copyright ownership.
 The ASF licenses this file to You under the Apache License, Version 2.0
 (the "License"); you may not use this file except in compliance with
 the License.  You may obtain a copy of the License at

     http://www.apache.org/licenses/LICENSE-2.0

 Unless required by applicable law or agreed to in writing, software
 distributed under the License is distributed on an "AS IS" BASIS,
 WITHOUT WARRANTIES OR CONDITIONS OF ANY KIND, either express or implied.
 See the License for the specific language governing permissions and
 limitations under the License.
-->

<modulesynopsis metafile="mod_heartmonitor.xml.meta">

<name>mod_heartmonitor</name>
<description></description>
<status>Extension</status>
<sourcefile>mod_heartmonitor.c</sourcefile>
<identifier>heartmonitor_module</identifier>
<compatibility>Available in 2.3 and later</compatibility>

<summary>
    <note><!-- FIXME: -->This document is still under development.</note>
</summary>

<directivesynopsis>
<name>HeartbeatListen</name>
<description>Address to listen for heartbeat requests</description>
<syntax></syntax>
<contextlist><context>server config</context></contextlist>

<usage>
    <note><!-- FIXME: -->This document is still under development.</note>
</usage> 
</directivesynopsis>

<directivesynopsis>
<name>HeartbeatStorage</name>
<description>Path to store heartbeat data</description>
<syntax>HeartbeatStorage <var>file-path</var></syntax>
<default>HeartbeatStorage logs/hb.dat</default>
<contextlist><context>server config</context></contextlist>

<usage>
    <note><!-- FIXME: -->This document is still under development.</note>
</usage> 
</directivesynopsis>

</modulesynopsis>
